{
  "messageId": "message-id-example",
  "type": "StartMediaRecording",
  "version": "1.0.0",
  "occurredAt": "2026-09-08T12:00:00Z",
  "tenantId": "tenant-id-example",
  "regionId": "region-id-example",
  "clusterId": "cluster-id-example",
  "correlationId": "correlation-id-example",
  "data": {
    "sessionId": "session-id-example",
    "audio": true,
    "video": false,
    "expectedRevision": "1"
  },
  "idempotencyKey": "idempotency-key-example"
}
